{
  "$schema": "https://json-schema.org/draft/2020-12/schema",
  "$id": "https://spec.eonstream.org/schemas/module-manifest.v0.schema.json",
  "title": "EON Stream module manifest (v0 — UNSTABLE)",
  "description": "Describes a EON Stream module: what it is, what it needs, what it is allowed to do, and who signed it. v0 is explicitly unstable and may break without a migration path. First-party modules use this same schema and the same permission model as third-party ones (madde 3).",
  "type": "object",
  "required": ["schemaVersion", "id", "name", "version", "kind", "api"],
  "additionalProperties": false,
  "properties": {
    "schemaVersion": {
      "description": "Version of THIS schema the document is written against.",
      "const": 0
    },
    "id": {
      "description": "Globally unique, reverse-DNS. Immutable for the life of the module: it is the identity used by dependencies, signatures and revocation.",
      "type": "string",
      "pattern": "^[a-z0-9]([a-z0-9-]*[a-z0-9])?(\\.[a-z0-9]([a-z0-9-]*[a-z0-9])?){1,6}$",
      "maxLength": 128,
      "examples": ["org.eon.stream.video", "org.eon.stream.creator.package", "community.example.theme"]
    },
    "name": {
      "description": "Human-readable name. Localisable via the i18n map (madde 40).",
      "type": "string",
      "minLength": 1,
      "maxLength": 64
    },
    "description": { "type": "string", "maxLength": 512 },
    "version": {
      "description": "Semantic version of the module itself.",
      "type": "string",
      "pattern": "^(0|[1-9]\\d*)\\.(0|[1-9]\\d*)\\.(0|[1-9]\\d*)(?:-[0-9A-Za-z-.]+)?$"
    },
    "kind": {
      "description": "What class of module this is. Determines which host surfaces it may attach to. A module declares exactly one kind.",
      "enum": [
        "viewer.video",
        "viewer.music",
        "viewer.file",
        "viewer.package",
        "creator",
        "marketplace",
        "theme",
        "ui",
        "edu.tool",
        "edu.identity"
      ]
    },
    "api": {
      "description": "Range of EON Stream module API versions this module works against. The client refuses to load a module whose range excludes its own API version, and says so (madde 5).",
      "type": "object",
      "required": ["min"],
      "additionalProperties": false,
      "properties": {
        "min": { "type": "string", "pattern": "^\\d+(\\.\\d+)?$" },
        "max": { "type": "string", "pattern": "^\\d+(\\.\\d+)?$" }
      }
    },
    "runtime": {
      "description": "How the module is executed. 'declarative' carries no code at all and is the only runtime available in v1 for third-party modules (madde 4). 'wasm' is the intended sandbox for code-executing modules and is not implemented yet. 'native' is reserved for first-party modules compiled into the client.",
      "type": "object",
      "required": ["type"],
      "additionalProperties": false,
      "properties": {
        "type": { "enum": ["declarative", "wasm", "native"] },
        "entry": {
          "description": "Entry point relative to the module root. A declarative module points at its JSON document; a wasm module at its .wasm binary.",
          "type": "string",
          "maxLength": 256
        }
      },
      "allOf": [
        {
          "if": { "properties": { "type": { "enum": ["wasm", "declarative"] } }, "required": ["type"] },
          "then": { "required": ["entry"] }
        }
      ]
    },
    "permissions": {
      "description": "Capabilities the module requests. Each maps to a host function the sandbox grants or withholds; nothing is granted implicitly. A declarative module may request nothing. Requests are shown to the user before installation.",
      "type": "array",
      "uniqueItems": true,
      "maxItems": 16,
      "items": {
        "enum": [
          "net.fetch",
          "storage.local",
          "fs.read.userSelected",
          "fs.write.downloads",
          "player.control",
          "catalog.read",
          "addons.read",
          "ui.surface",
          "notifications.post",
          "clipboard.write"
        ]
      }
    },
    "permissionRationale": {
      "description": "Per-permission justification shown to the user. A permission without a rationale is a review finding, not an error.",
      "type": "object",
      "additionalProperties": { "type": "string", "maxLength": 240 }
    },
    "dependencies": {
      "description": "Other modules required at runtime. If one is missing the client offers to install it; a material package that needs an absent viewer opens partially rather than not at all (madde 16c).",
      "type": "array",
      "maxItems": 16,
      "items": {
        "type": "object",
        "required": ["id", "version"],
        "additionalProperties": false,
        "properties": {
          "id": { "type": "string", "maxLength": 128 },
          "version": {
            "description": "Semver range, npm syntax.",
            "type": "string",
            "maxLength": 64,
            "examples": ["^1.2.0", ">=0.3 <1.0"]
          },
          "optional": { "type": "boolean", "default": false }
        }
      }
    },
    "builds": {
      "description": "Which build profiles may load this module. An Edu build loads only modules signed with the Edu key (madde 22); declaring 'edu' here is a statement of intent, not the enforcement — enforcement is the signature.",
      "type": "array",
      "uniqueItems": true,
      "minItems": 1,
      "default": ["stream"],
      "items": { "enum": ["stream", "edu"] }
    },
    "platforms": {
      "type": "array",
      "uniqueItems": true,
      "items": { "enum": ["windows", "linux", "macos", "android"] }
    },
    "license": {
      "description": "SPDX identifier for the module's own code or content.",
      "type": "string",
      "maxLength": 64
    },
    "author": {
      "type": "object",
      "additionalProperties": false,
      "properties": {
        "name": { "type": "string", "maxLength": 96 },
        "url": { "type": "string", "format": "uri", "maxLength": 512 },
        "contact": { "type": "string", "maxLength": 256 }
      }
    },
    "icon": {
      "description": "Path within the module, or a data URI. Remote icon URLs are rejected: loading one would leak that the module is installed.",
      "type": "string",
      "maxLength": 2048
    },
    "i18n": {
      "description": "Locale overrides for name and description. Keys are BCP 47 tags.",
      "type": "object",
      "propertyNames": { "pattern": "^[a-z]{2,3}(-[A-Za-z0-9]{2,8})*$" },
      "additionalProperties": {
        "type": "object",
        "additionalProperties": false,
        "properties": {
          "name": { "type": "string", "maxLength": 64 },
          "description": { "type": "string", "maxLength": 512 }
        }
      }
    },
    "signature": {
      "description": "Detached signature envelope. Absent in source trees; required for anything the client installs. See docs/signing-and-revocation.md.",
      "type": ["object", "null"],
      "required": ["algorithm", "keyId", "value"],
      "additionalProperties": false,
      "properties": {
        "algorithm": { "enum": ["ed25519"] },
        "keyId": { "type": "string", "maxLength": 64 },
        "value": { "type": "string", "contentEncoding": "base64" },
        "signedAt": { "type": "string", "format": "date-time" }
      }
    }
  },
  "allOf": [
    {
      "$comment": "A theme carries no code, ever. This is the hard boundary in madde 4 — expressed in the schema so it cannot be forgotten in an implementation.",
      "if": {
        "properties": { "kind": { "const": "theme" } },
        "required": ["kind"]
      },
      "then": {
        "properties": {
          "runtime": { "properties": { "type": { "const": "declarative" } } },
          "permissions": { "maxItems": 0 }
        }
      }
    }
  ]
}
