{
  "schemaVersion": 0,
  "id": "community.example.solarized",
  "name": "Solarized",
  "description": "A declarative theme. Carries no code and requests no permissions.",
  "version": "1.1.0",
  "kind": "theme",
  "api": { "min": "0.1", "max": "0" },
  "runtime": { "type": "declarative", "entry": "theme.json" },
  "permissions": [],
  "license": "MIT",
  "author": { "name": "Example Author", "url": "https://example.org" },
  "builds": ["stream", "edu"],
  "i18n": { "tr": { "name": "Solarized", "description": "Bildirimsel tema; kod icermez." } }
}
